company_name,founded_year,location,industry,latest_funding,website,linkedin,description
Alma,2023.0,,information technology & services,Seed,https://www.tryalma.com/,,"Alma simplifies immigration for technologists, founders, researchers, and others at the top of their fields with our highly experienced immigration lawyers and a user-friendly platform."
GlossGenius,2016.0,,information technology & services,Series C,http://www.glossgenius.com,,"GlossGenius is one of the quickest growing solutions powering small business owners across the US in the beauty & wellness space with elegant, vibrant, and intuitive software. GlossGenius's complete ""business-in-a-box"" platform spans powerful SaaS and fintech solutions, enabling tens of thousands of business owners to run their entire set of business operations every day. GlossGenius is backed by Bessemer Venture Partners, Imaginary Ventures, Left Lane Capital, L Catterton, and a number of high-profile strategic investors and has raised a total of ~$70mm."
Ethic,2015.0,,financial services,Series C,http://www.ethic.com,,We've spent the last 9 years simplifying the complex world of values-aligned investing. Our platform empowers wealth advisors and investors to create portfolios that align personal values with financial goals.
Thirty Madison,2017.0,,hospital & health care,Series C,http://www.thirtymadison.com,,"Thirty Madison exists to deliver on healthcare's biggest opportunities: access and affordability; patient outcomes; and patient experience. With empathy at the heart of its innovation, its proprietary care model empowers hundreds of thousands of people with ongoing conditions with accessible, effective treatments across a lifetime of care. Learn more at ThirtyMadison.com."
GreenLite,2022.0,,information technology & services,Seed,http://www.greenlite.com,,"GreenLite makes getting a construction permit fast, predictable, and transparent. GreenLite is revolutionizing development in America by streamlining the collaboration between developers, builders, and local regulatory authorities. GreenLite's software powers our Private Plan Review offering, serving many of the nation's largest public retailers, developers, and production home builders. By leveraging our technology, our customers save months on each project, significantly accelerating their timelines. GreenLite is founded by experts in technology, development, and within the AEC (Architecture, Engineering, and Construction) industry, and backed by leading venture capital firms. We are at the forefront of the privatization of construction permitting and plan review, reshaping a multi-hundred billion dollar industry. Let's connect: Sales inquiries: sales@greenlite.com Interview and media requests: media@greenlite.com Investment opportunities: ir@greenlite.com Job Opportunities: recruiting@greenlite.com"
Livewire,2021.0,,marketing & advertising,Series A,http://www.livewire.group,,"In game. Around game. For the love of the game. We are global leaders in gaming marketing and gametech, created integrated and immersive solutions that deliver targeted and measurable results for brands. Our global team of gaming natives solve brand problems and create opportunities for brands to build authentic and positive engagement with the gaming audience."
ConcertoCare,2015.0,,hospital & health care,Series B,http://www.concertocare.com,,"ConcertoCare is a tech-enabled, value-based provider of at-home, comprehensive care for seniors and other adults with unmet health and social needs. ConcertoCare deploys physician-led interdisciplinary teams— supported by its proprietary population health platform, Patient3D®, and clinical decision support tools — to manage the country's most medically and socially complex and costly patients in ways that keep them in their homes and out of the hospital. The results are better health outcomes, reduced costs, and a more personalized and integrated experience for patients and their families. ConcertoCare works with a wide variety of payers and can partner with a patient's current primary care physician or serve as the provider of record. Led by a world-class team of home-based care physicians, population health technology experts, former policymakers, and senior health plan executives, ConcertoCare serves seniors across the country. For more information, visit www.concertocare.com. NOTE: Protect yourself from recruitment fraud. ConcertoCare will never ask for financial information or payment, or for personal information such as bank account number or social security number during the job application or interview process. Any emails from the ConcertoCare recruiting team will come from a @concertocare.com email address."
Vantage,2020.0,,information technology & services,Series A,http://www.vantage.sh,,"Vantage is a cloud cost observability platform with more than a dozen native integrations, including AWS, Azure, GCP, Kubernetes, Datadog, Snowflake, Databricks and more. Thousands of organizations globally, ranging from startups to F500 companies, rely on Vantage to optimize billions of dollars in annualized infrastructure costs. Vantage was founded by former employees of AWS, Digital Ocean, and GitHub and is backed by top venture capital firms, Andreessen Horowitz and Scale Venture Partners."
Immunai,2019.0,,research,Series B,http://www.immunai.com,,"Comprehensively mapping and decoding the immune system with single-cell biology and AI to power new therapeutic discoveries, accelerate drug development and improve patient outcomes"
Rockerbox,2013.0,,information technology & services,Seed,http://www.rockerbox.com,,"Rockerbox centralizes advertising data across all media channels to help marketers solve their core challenges—accurately attributing conversions, optimizing media investments, and driving growth. Our products simplify the complexity of multi-channel marketing, enabling large brands to leverage best-in-"
Pinwheel,2018.0,,information technology & services,Series B,http://www.pinwheelapi.com,,"Pinwheel helps banks win primacy with user-centric solutions that deepen relationships and grow lifetime value. Pinwheel's market leading digital deposit switch solution, used by the world's leading financial institutions, delivers 2x better conversion than the industry standard, greater security, and first-of-its kind share of wallet insights to power customer engagement programs to new heights."
Kalshi,2019.0,,financial services,Series A,http://www.kalshi.com,,"The first US federally regulated exchange where you can trade on the outcome of any event. Kalshi's historical regulatory approval from the CFTC enables it to offer a new asset class called ""event contracts,"" which allow traders to take positions on whether a future event will happen or not. Kalshi aims to enable investors to trade on almost anything with economic relevance from Covid numbers to whether a bill will pass in Congress, broadening the historical definition of what a commodity derivative is and paving the way for the futures market to catch up to the novel risks facing the economy today. Kalshi is backed by Sequoia, Henry Kravis, Charles Schwab, and Y Combinator."
Mantra Health,2018.0,,mental health care,Series A,http://www.mantrahealth.com,,"Mantra Health is a digital mental health clinic on a mission to improve young peoples' mental healthcare access through clinical services, software, and design. Since our founding in 2018, we've built a comprehensive treatment service for young adults with various mental health conditions. We've raised over $27 million to work with students at universities and colleges across the country such as MIT, Cornell, and the University of Minnesota. Our students see clinically significant differences in their mental health during treatment with us. We're particularly proud that nearly two-thirds of students with access to Mantra report that Mantra's program helped them stay in school."
Reachdesk,2018.0,,information technology & services,Series B,http://www.reachdesk.com,,"Reachdesk enables companies to deliver moments that matter at scale, globally, throughout the entire customer lifecycle. Through Reachdesk companies can deliver gifts and direct mail that build deeper connections with customers, prospects and employees at the click of a button. Our integrations to your tech stack power a clear and quantifiable ROI; the direct channel is no longer a guessing game."
Priori,2013.0,,internet,Series A,http://www.priorilegal.com,,"Priori transforms how legal teams find, engage, and manage outside counsel, connecting them with the right talent at the right price for any need. With over a decade of experience partnering with legal teams, we provide access to flexible talent, a global law firm marketplace, and cutting-edge software for managing law firm panels and legal RFP workflows."
EvolutionIQ,2019.0,,information technology & services,Series B,http://www.evolutioniq.com,,"EvolutionIQ created the world's first fully AI-driven claims guidance platform for the most sophisticated insurance carriers in the world. Our platform makes insurance more fair, transparent and affordable."
Bikky,2017.0,,information technology & services,Seed,http://www.bikky.com,,"Bikky is the first Customer Data Platform (CDP) built exclusively for large, multi-unit restaurant brands. By integrating with point-of-sale systems, online ordering providers, payment processors, and loyalty programs, Bikky is the only CDP able to build comprehensive datasets about everything from the performance of menus to the frequency and lifetime value of guests. With the platform, everyone from the C-Suite to the marketing team is empowered to make better decisions about the business and measure if those decisions are contributing positively to the bottom line. Bikky was founded on the belief that restaurants deserve the same access to data as the largest, most sophisticated businesses in the world, and is proud to serve thousands of restaurant locations across the U.S., including major brands like Bojangles, MOD Pizza, Dave's Hot Chicken, and Long John Silver's. Bikky is based in New York City and has raised over $15 million in funding to date."
Envisagenics,2014.0,,research,Series B,http://www.envisagenics.com,,"Envisagenics was founded in 2014 as a spinout of Cold Spring Harbor Laboratory. Our mission is to reduce the complexity of biomedical data to accelerate the development of innovative therapeutic solutions through RNA splicing analytics and artificial intelligence. We focus on the discovery of RNA therapeutics. Over 30 million people in the US suffer from genetic diseases or cancer that could be caused by mutations affecting RNA splicing. 370 human diseases are known to be caused by splicing errors, and more remain to be discovered. Our breakthrough technology, SpliceCore, is a cloud-based platform that is experimentally validated to predict drug targets and biomarkers through splicing discovery from RNA-seq data, using Artificial Intelligence. We are using our software to identify splicing errors causative of diseases, identify the right drug-targets and develop RNA therapeutics through partnerships and collaborations with Biopharma. Our in-silico RNA therapeutics discovery platform replaces expensive drug-target selection and lead design with efficient computer simulations, decreasing time, cost, and failure risk of drug development programs."
Bespoke Post,2011.0,,retail,Series B,http://www.bespokepost.com,,"Bespoke Post is an e-commerce retailer and membership service that helps people discover high-quality gear from the best small brands in the world. From clothing to camping gear, boots to barware– our mission is to help customers cut through the clutter, and find goods and guidance that spark their curiosity and fuel a fun, interesting, adventurous lifestyle. Since we opened shop back in 2011, we've proudly spent more than $150 million with small brands and welcomed over 1.5 million Members. Our team is based in New York City, and we're always looking for great new people to join our crew. So don't be shy about reaching out."
Adaptive,2022.0,,information technology & services,Series A,http://www.adaptive.build,,"Automating finance for builders and remodelers. Bills, receipts, free payments, budgets, invoices, draws - everything synced with QB."
Chapter,2020.0,,insurance,Series C,http://www.askchapter.org,,"Chapter is the industry leading Medicare navigation platform that helps simplify and optimize Medicare for patients, customers, and clients of the most impactful organizations in the country. Hundreds of organizations rely on Chapter to build, maintain and demonstrate trust through Medicare guidance in a way that improves brand value for Chapter's partners. Chapter's unbiased, consumer-centric approach has been recognized by the National Council on Aging and led the US Senate to invite Chapter's CEO to testify about how to improve the Medicare enrollment experience for America's seniors. Chapter has recently been recognized as a Forbes 2023 next Billion Dollar Startup and a Fortune Impact 20 company. Our world class investors include Addition Capital, Narya Ventures, Peter Thiel, Maverick Ventures, Susa Ventures, XYZ Ventures, Health 2047 of the American Medical Association, and many others. We are home to a diverse team of extreme talent who are motivated to improve the lives of America's seniors. We are actively hiring across teams. Join us at https://askchapter.org/careers."
Transfr,2017.0,,information technology & services,Series C,http://www.transfrinc.com,,"Transfr is a New York-based VR platform that offers simulation-based workforce development and training programs for sectors including automotive, aerospace and construction."
Altana,2018.0,,information technology & services,Series C,http://www.altana.ai,,"Altana, based in New York, is the world's first Value Chain Management System, a collaborative, public-private network that enables customers to take command of their extended supplier and distribution networks — from raw material origins to the sale of finished products. By applying artificial intelligence to the world's largest body of supply chain data, Altana reveals these previously opaque global networks and powers workflows across them. Customers like Boston Scientific, General Atomics, L.L.Bean, Maersk, US Customs and Border Protection, and the UK Department of Business and Trade use Altana to build secure, resilient, efficient, and sustainable global value chains. To learn more, visit: https://altana.ai/."
Block Renovation,2017.0,,information technology & services,Series C,http://www.blockrenovation.com,,"Block is a platform transforming the $450 billion renovation industry. Doing a home renovation is a very stressful and hard process. Our mission is to give homeowners a better way to improve the spaces they live in, and to give contractors a better way to work. Block simplifies the renovation process and gives homeowners certainty on outcomes, quality, price, and time. We are building an ambitious, tenacious, and creative team who is unafraid of tackling new challenges. The founders are former leaders at Casper, HuffPost, and Rent the Runway. Investors include New Enterprise Associates, Lerer Hippeau Ventures, Obvious Ventures, Giant Ventures, and more."
Cadence,2020.0,,hospital & health care,Series B,http://www.cadence.care,,"Cadence is a health technology company helping the nation's most patient-centric health systems deliver more consistent, proactive healthcare every day. Cadence's Remote Patient Care solution couples powerful new technology with clinical excellence, providing its patients a precise and personal level of care all outside of the four walls of the hospital. At Cadence, we aim to exceed the expectations of our patients, clinicians, and partners every day. Our team values trust and autonomy, and we empower one another to make decisions, solve problems and build something better. We give clear, candid feedback with the utmost honesty and encouragement. If you're interested in joining us, explore opportunities at www.cadence.care. *Note that in all Cadence videos posted on this page, testimonials are those of real Cadence patients who have not been compensated and voluntarily provided their statements and opinions. Patient results and experiences with Cadence may vary and are unique and individual to each patient."
Playbook,2017.0,,"health, wellness & fitness",Series A,http://www.joinplaybook.com,,"Playbook is the #1 creator economy platform for creators in fitness, wellness, and sports. Our combination of mobile SaaS tools and services enables today's creator class to turn their iPhone training content into a meaningful income. Start creating yourself today: www.joinplaybook.com"
Helaina,2019.0,,research,Series B,http://www.myhelaina.com,,Helaina is a biotech company pushing the boundaries of what food can do for health.
Branch,2018.0,,furniture,Series A,http://www.branchfurniture.com,,"Branch makes it easy for teams of every size to create the office you love. From ordering and assembly to space planning and pickup, we take care of furniture so you can sit down (or stand) and get to work."
Mighty,2015.0,,information technology & services,Series B,http://www.mighty.com,,Mighty is a provider of injury lien management and tracking solutions for billing companies.
CertiK,2018.0,,computer & network security,Series B,http://www.certik.com,,"CertiK is a pioneer in blockchain security, leveraging best-in-class AI technology to protect and monitor blockchain protocols and smart contracts. Founded in 2018 by professors from Yale University and Columbia University, CertiK's mission is to secure the web3 world. CertiK applies cutting-edge innovations from academia to enterprise, enabling mission-critical applications to scale with safety and correctness. One of the fastest-growing and most trusted companies in blockchain security, CertiK is a true market leader. To date, CertiK has worked with nearly 4,000 Enterprise clients, secured over $360 billion worth of digital assets, and has detected nearly 70,000 vulnerabilities in blockchain code. Our clients include leading projects such as Aave, Polygon, Binance Smart Chain, Terra, Yearn, and Chiliz. ​​CertiK is backed by Insight, Partners, Sequoia, Tiger Global, Coatue Management, Lightspeed, Advent International, SoftBank, Hillhouse Capital, Goldman Sachs, Coinbase Ventures, Binance, Shunwei Capital, IDG Capital, Wing, Legend Star, Danhua Capital and other investors."
"Velan Studios, Inc.",2016.0,,computer games,Series A,http://www.velanstudios.com,,"Velan Studios is a new development studio made up of a diverse team of game industry veterans. We have created hundreds of games, selling millions of copies over the past 25 years. Our team is embarking on a new journey to create breakthrough experimental games that will stoke the imagination and entertain, and new kinds of experiences that push the frontier of gaming forward."
Softheon,2000.0,,information technology & services,Series A,http://www.softheon.com,,"Softheon powers growth to make healthcare more productive, intelligent, and successful. Our solutions enable health plans and government health agencies to measurably reduce their costs and serve more people, faster. Every day, Softheon's products help people to buy the insurance coverage that's right for them, keep them engaged, and empower them to stay healthy throughout their membership. Our vision making healthcare affordable, accessible, and plentiful for every American. Founded in 2000, Softheon's Software-as-a-Service (SaaS) and Business Process-as-a-Service (BPaaS) solutions solve complex operational and service challenges for health plans and government health agencies. By offering modular solutions designed to integrate with existing systems, Softheon reduces administrative burdens by streamlining critical processes in healthcare. Softheon's rapidly adapting technology and agile approach to implementation enables clients to proactively respond to changing regulatory environments and consumer demand. Softheon has been recognized as a leading SaaS and BPaaS provider by IDC, AHIP, ACAP, and HCEG. Trusted by CMS and 8 State agencies, Softheon's clients span multiple industries. In 2021, Softheon ranked on the Inc. 5000 regional list for fastest growing companies, and Best in Biz Awards named Softheon one of the top Companies of the Year in the Northeast Region. Softheon Values: • Be Open, Honest, and Constructive • Channel Passion into Purpose • Cultivate Excellence • Relationships Matter • We > I"
RealSelf,2006.0,,information technology & services,Series B,http://www.realself.com,,"For two decades, RealSelf has been the trusted authority in the aesthetics space. Now, we're evolving into something even more powerful - a dynamic digital ecosystem that puts you at the center of your aesthetic journey. What sets us apart? We're the only destination that combines verified patient experiences, board-certified expert guidance, and cutting-edge technology to help you make confident, informed decisions about your aesthetic goals. From revolutionary skincare to transformative procedures, RealSelf remains your most trusted partner in discovering treatments and providers that are truly 'Worth It.' Visit RealSelf.com to experience our evolution and follow us on social, for daily inspiration and expert advice."
CB Insights,2009.0,,information technology & services,Series A,http://www.cbinsights.com,,"CB Insights is an AI super analyst for market intelligence. It delivers instant insights that help you bet on the right markets, track competitors, and source the right companies. Our AI super analyst is powerful because it is built on the validated database of companies and markets that CB Insights is famous for. The AI super analyst is available as an API, too. Trusted by the world's smartest companies, CB Insights is headquartered in New York, NY. Visit www.cbinsights.com to see us in action. We also publish one of the most loved newsletters in tech. Join half a million readers: www.cbinsights.com/newsletter"
Valon,2019.0,,information technology & services,Series C,http://www.valon.com,,"Valon is on a mission to empower every homeowner. We believe the journey of home ownership starts when you get your keys, but lasts far beyond. We're creating a world where home ownership comes with ease, security, and financial know-how. Valon Mortgage, Inc. NMLS #1907140 https://nmlsconsumeraccess.org/"
IEX,2012.0,,financial services,Series C,http://www.iex.io,,"At IEX, we're passionate about building technology that moves finance forward. Our story began when we built IEX Exchange, a stock exchange designed to deliver high-performance results for all investors. Our goal is to build transformative technology without ever compromising our integrity - and we're just getting started. To learn more, visit iex.io."
Aetion,2012.0,,information technology & services,Series C,http://www.aetion.com,,"Aetion is a health care analytics company that delivers real-world evidence for the manufacturers, purchasers, and regulators of medical treatments and technologies. The Aetion Evidence Platform® analyzes data from the real world to produce transparent, rapid, and scientifically validated answers on safety, effectiveness, and value. Founded by Harvard Medical School faculty members with decades of experience in epidemiology and health outcomes research, Aetion informs health care's most critical decisions — what works best, for whom, and when — to guide product development, commercialization, and payment innovation. Aetion is based in New York City and backed by investors including New Enterprise Associates (NEA), Warburg Pincus, Flare Capital Partners, Greenspring Associates, Lakestar, B Capital, Foresite Capital, Town Hall Ventures, McKesson Ventures, Sanofi Ventures, EDBI, Johnson & Johnson Innovation—JJDC, Inc., UCB, Amgen Ventures, and Horizon Health Services, Inc. Learn more at aetion.com and follow us at @aetioninc."
Basis,2023.0,,information technology & services,Series A,http://www.getbasis.ai,,AI Platform for Accounting firms giving accountants a team of AI assistants
PermitFlow,2021.0,,information technology & services,Series A,http://www.permitflow.com,,PermitFlow is the nation's leading permit application and management platform. We help builders across the country to simplify and speed up the process of obtaining construction permits.
Sunstone Credit,2015.0,,financial services,Series A,http://www.sunstonecredit.com,,"Sunstone Credit is on a mission to democratize access to solar for small and medium sized businesses (SMBs). Sitting at the intersection of climate, finance and technology, Sunstone has built a best-in-class technology platform and partnered with leading financial institutions and a national network of solar developers to provide SMB borrowers access to simple, affordable and easy-to-understand solar loan products with flexible terms and a streamlined application process. When SMB customers go solar using Sunstone's products, they save money and reduce their carbon footprint, driving a clean, green future for all. For more information about becoming a partner, please contact info@sunstonecredit.com."
Modern Age,2020.0,,"health, wellness & fitness",Series A,http://www.modern-age.com,,"Modern Age is New York City's first longevity-focused wellness clinic, offering proactive solutions to slow down the aging process inside and out. Our holistic approach spans skin and hair treatments, hormone health, cognitive health, sexual health, weight loss, and IV therapies. Our goal is to help clients age on their own terms by integrating cutting-edge science with personalized care. Services like Hydrafacial, Botox, NAD+, and neurofeedback therapy are just a few of the ways we empower individuals to feel and look their best."
