company_name,founded_year,location,industry,latest_funding,website,linkedin,description
Edge,2014.0,,information technology & services,Series A,http://www.edge.app,,"Edge allows users to buy, sell, and trade cryptocurrency with a high level of security and privacy. The Edge mobile app supports the leading cryptocurrencies providing a large selection of assets for trading. With over a dozen integrated exchange partners, users can also buy and sell crypto from dozens of payment methods in hundreds of countries. Built on our open source Edge Security SDK, the Edge mobile app fully encrypts all user data providing a level of privacy unmatched by any conventional tech company. No staff members at Edge have access to any user funds or personal information. This is security and privacy by default and by design 🕶 With our commitment to building a fully open source app and platform, we provide the transparency required to secure the next generation financial ecosystem"
Amberflo.io,2020.0,,information technology & services,Series A,http://www.amberflo.io,,"Billing and Metering infrastructure for Usage-Based Pricing and Billing business models. Amberflo is the leading Usage-Based Pricing (UBP) and Billing platform built from the ground up by a team of ex.AWS engineers to handle any form of Usage-Based Pricing at scale. Customers such as Equinix, LaunchDarkly, and Firebolt use our metering and billing infrastructure to delight their customers with flexible usage-based pricing plans with accurate and on-demand metered invoicing and billing. Amberflo customers realize tremendous ROI in the form of time to market for new products and services, huge cost savings by reclaiming engineering resources to work on core initiatives, and increased customer satisfaction resulting in higher NRR."
Merge,2020.0,,information technology & services,Series B,http://www.merge.dev,,"Merge is one API to add hundreds of integrations to your product. Merge's platform makes secure data access easy by offering Unified APIs across key software categories, including HRIS, accounting, CRM, file storage, and more. Merge handles the full integrations lifecycle — from an easy initial build taking just weeks to providing integration observability tools ensuring customer delight, and fully owning the maintenance of integrations. Thousands of companies use Merge to power their integrations, enabling them to unblock sales, reduce customer churn, accelerate time to market for new products, and save engineering costs and resources. Merge is backed by $75 million in funding from Accel, NEA, and Addition. Merge was founded in 2020 by Shensi Ding and Gil Feig and is proudly built in San Francisco, New York City, and Berlin. We're hiring! Apply here: https://www.merge.dev/careers/"
Jasper,2020.0,,information technology & services,Series A,http://www.jasper.ai,,"Jasper is the purpose-built generative AI platform for marketing. Built on a foundation of enterprise trust, Jasper deeply understands marketing, delivering advanced brand control and an intuitive AI toolkit that allow marketers to build apps and workflows to accelerate their success. Looking to connect with our team? Shoot us a DM 👋"
Terremoto Biosciences,,,research,Series B,http://www.terremotobio.com,,"Terremoto Biosciences is a covalent drug discovery and development engine creating highly targeted, small molecule medicines with unmatched selectivity, potency and efficacy. The company leverages the power of lysine-based covalency across the disease spectrum to develop both best-in-class therapies against known drug targets and first-in-class medicines against the previously undruggable. Many of Terremoto's founders helped establish this emergent area of science, with the intent to broaden the number of tractable targets and deliver medicines with superior therapeutic benefit. Terremoto is supported by leading investors OrbiMed and Third Rock Ventures. More information is available at www.terremotobio.com."
Contextual AI,,,information technology & services,Series A,http://www.contextual.ai,,"Contextual AI is the leader in retrieval-augmented generation (RAG). Founded by the pioneers of RAG, Contextual AI's mission is to change the way the world works through AI. The Contextual AI platform empowers enterprises to build specialized RAG agents for expert knowledge work. Fortune 500 companies, such as HSBC and Qualcomm, rely on Contextual AI to boost productivity for thousands of their subject-matter experts. You can learn more and explore open roles at contextual.ai"
Celigo,2011.0,,information technology & services,Series C,http://www.celigo.com,,"The Celigo platform is a world-class integration platform as a service (iPaaS) that allows IT and line of business teams alike to automate both common and custom business processes, enabling the entire organization to be more agile and innovate faster than ever before."
Fandango,2000.0,,information technology & services,Series C,http://www.fandango.com,,Fandango is a California-based online platform that enables individuals to book movie tickets.
"Centrillion Technology, Inc.",2009.0,,research,Series C,http://www.centrilliontech.com,,"Centrillion Tech' mission is to empower researchers, physicians and consumers to have responsible and cost effective access to genomic information and to advance personalized health care, molecular diagnostics and individualized wellness management. Founded in 2009, Centrillion Biosciences'​ research and product development operation is focused on novel bridging technologies that solve critical problems in large-scale genomic analyses (including sequencing) and informatics. Our service operation has provided high-quality genomic services and has been well received by academic and industrial customers"
Recurly,2009.0,,information technology & services,Series C,http://www.recurly.com,,"Recurly is how leading brands grow subscription revenue. We're on a mission to help the world's leading brands navigate, scale and thrive in the subscription economy. From subscriber management and payments orchestration to churn management and real-time analytics, our all-in-one platform is designed to accelerate and enhance every aspect of the subscription lifecycle — and it's how our merchants are earning an average ROI of 14x. Trusted by category-defining brands like Sling, Twitch, BarkBox, FabFitFun, Paramount, Lucid, and Sprout Social, Recurly's platform simplifies subscription billing and revenue management, giving teams the tools to create winning subscriber experiences. Founded in San Francisco in 2009, Recurly has offices in Broomfield, London and Medellin. Recurly | Get ahead of what's next."
Gorgias,2015.0,,information technology & services,Series C,http://www.gorgias.com,,"Gorgias is a one-of-a-kind customer service platform specifically designed for ecommerce businesses to deliver effortless customer service at every stage of growth. With cutting-edge automation and AI capabilities, Gorgias revolutionizes how online stores interact with their customers by providing efficient and personalized support across email, voice, SMS, live chat, and social media channels. Founded in 2015, Gorgias began as a two-person team and has grown to more than 250 employees and nine offices in San Francisco, New York, Charlotte, Toronto, Belgrade, Buenos Aires, Paris, Lisbon, and Sydney. As a certified B Corporation, Gorgias is proud to be a leader in sustainable and equitable workplace practices. Today, Gorgias serves 14,000+ merchants in the ecommerce space, including Steve Madden, Glossier, BrüMate, and TUSHY."
Aera Technology,2017.0,,information technology & services,Series C,http://www.aeratechnology.com,,"Aera Technology is the Decision Intelligence company that transforms how enterprises make and execute decisions. Our innovative platform, Aera Decision Cloud™, integrates with existing systems and data sources to enable business decision making in real time, at scale. Trusted by many of the world's best-known companies and brands, Aera is helping enterprises operate sustainably, intelligently, and efficiently."
Moloco,2013.0,,marketing & advertising,Series C,http://www.moloco.com,,"Moloco's mission is to empower businesses of all sizes to grow through operational machine learning. With Moloco's machine learning platform for growth and performance, every app publisher, commerce marketplace, and streaming business can now unlock the value of their unique, first-party data. Moloco Ads enables performance marketers to scale user acquisition for mobile apps through our advanced machine learning models. Moloco Commerce Media enables retailers and marketplaces to build their own ads business with a flexible solution that delivers relevance, results, and automation for scaled and streamlined ad operations. Moloco Streaming Monetization enables streaming media companies to revolutionize their monetization strategy by building an outcomes-based ads business that delivers relevancy for users and results for advertisers. Moloco was founded in 2013 by a team of machine learning engineers and has offices throughout the US, the UK, Germany, Korea, China, India, Japan, and Singapore."
Kentik,2014.0,,computer networking,Series C,http://www.kentik.com,,"Kentik is the network observability company. Our platform is a must-have for the network front line, whether Enterprise or service provider. Network professionals turn to the Kentik Network Observability Platform to plan, run, and fix any network, relying on our infinite granularity, AI-driven insights, and insanely fast search. Kentik makes sense of network, cloud, host, and container flow, internet routing, performance tests, and network metrics. We show network pros what they need to know about their network performance, health, and security to make their business-critical services shine. Networks power the world's most valuable companies, and those companies trust Kentik."
Hasura,2017.0,,information technology & services,Series C,http://www.hasura.io,,"Hasura is a universal data access layer for next-gen apps and AI With Hasura, you can effortlessly deploy a universal data service layer that lets your apps fetch just the data they need – quickly and securely – no matter its type or location. We are a venture backed company with offices in Bangalore and San Francisco. Our investors include Nexus Venture Partners and GREE."
PandaDoc,2014.0,,information technology & services,Series C,http://www.pandadoc.com,,"Stand out with the top‑rated solution for creating, managing, tracking, and esigning every important document you handle."
Clear Labs,2014.0,,biotechnology,Series C,http://www.clearlabs.com,,"Clear Labs harnesses the power of next-generation sequencing (NGS) to simplify complex diagnostics for clinical and applied markets. By creating a fully automated platform that brings together DNA sequencing, robotics and cloud-based analytics, Clear Labs democratizes genomics applications to deliver increased clarity. Clear Labs' turnkey platform accelerates outcomes and improves accuracy - from food-borne pathogens to infectious diseases, including SARS CoV-2. With a novel approach, Clear Labs is helping the world better understand, track and mitigate tomorrow's novel pathogens."
Hipcamp,2013.0,,information technology & services,Series C,http://www.hipcamp.com,,"Hipcamp is the #1 app to discover and book incredible campsites. Over the past decade, Hipcamp has unified the world's best camping options across peaceful private spots, iconic public lands and well-equipped campgrounds. Hipcamp has grown into a community of over 7 million campers who use our app to explore all of their options in one place — tent sites, RV spots or glamping — and find the perfect site to match their style. Each year, Hipcamp helps millions of campers sleep happily under the stars, boosting local economies and biodiversity along the way. To see a full list of our job openings, https://www.hipcamp.com/careers"
Pilot.com,2016.0,,accounting,Series C,http://www.pilot.com,,"Pilot provides the most reliable accounting, CFO, and tax services for startups and small businesses. We partner with thousands of companies to help them grow sustainably and operate more effectively."
Quizlet,2005.0,,e-learning,Series C,http://www.quizlet.com,,"Quizlet is a leading consumer learning brand that builds learning tools to inspire and empower students and teachers. Our team is already supporting a user base of over 60 million active users a month. We're also among the top 20 U.S. websites and top education apps for iOS and Android - and it's only the beginning. We're a fast-growing Series C startup, valued at $1 Billion and backed by Union Square Ventures, Costanoa Venture Capital, Icon Ventures, Owl Ventures, Altos Ventures and General Atlantic. With our massive reach and focus on delivering high-quality innovative learning tools, we're having a major global impact on education. Read more at https://quizlet.com/mission. Come join us — we're hiring!"
Axiado Corporation,2017.0,,computer & network security,Series C,http://www.axiado.com,,"Axiado is a leading hardware-anchored platform security solutions company deploying a novel, AI-driven approach to platform security against ransomware, supply chain, side-channel, and other cyberattacks in the growing ecosystem of cloud data centers, 5G networks, and other disaggregated compute networks. We offer a new processor called the Trusted Control/Compute Unit (TCU) that redefines security from the ground-up. Its hardware-anchored and AI-driven security technologies include Secure Vault root-of-trust/cryptography core and per-platform Secure AI pre-emptive threat detection engine."
CaptivateIQ,2017.0,,information technology & services,Series C,http://www.captivateiq.com,,"CaptivateIQ offers the smartest, most flexible way to automate sales commissions. Our innovative platform helps companies automate the administration, calculation, reporting, analysis, and management of even the most complex, variable-based commission plans. It is the only sales commission platform that can centralize and enrich data from disparate data sources into one powerful platform while also providing unbeatable flexibility and scalability to meet the needs of your organization. Leading companies such as Shutterstock, Gong, and Figma rely on CaptivateIQ for their sales commissions process to drive faster close times, reduce costly payout errors, and maximize sales performance."
Silo,2018.0,,information technology & services,Series C,http://www.usesilo.com,,"INTEGRATED SOFTWARE AND FINANCING SOLUTIONS FOR THE FOOD SUPPLY CHAIN Stay fresh. Stay ahead. Advance your business with Silo's integrated software solutions and financing services. Silo Capital services, including Instant Pay and Cash Advance, are strategically designed to boost cash flow and support growth. Additionally, our software solutions—covering inventory, orders, payments, and logistics—streamline operations for more effective management of perishable goods in a competitive market."
All Day Kitchens,2021.0,,information technology & services,Series C,http://www.allday.com,,"Hi, we're All Day. We offer a smarter way for restaurants and C Stores to add profitable, incremental sales to their existing stores."
Pave,2019.0,,information technology & services,Series C,http://www.pave.com,,"Pave is a suite of real-time compensation tools to help companies benchmark, plan, and communicate compensation."
Enfabrica,2019.0,,computer networking,Series C,http://www.enfabrica.net,,We develop the foundational fabric devices and technologies for the age of AI and accelerated computing at scale.
Celestial AI,2020.0,,semiconductors,Series C,http://www.celestial.ai,,"Celestial AI is the creator of the Photonic Fabric™ technology platform. For additional information, please visit https://www.celestial.ai."
"Arsenal Biosciences, Inc.",2019.0,,research,Series C,http://www.arsenalbio.com,,"ArsenalBiosciences, Inc., is a clinical stage programmable cell therapy company focused on the realization of solid tumor cell therapy to defeat cancer. Our discovery engine comprises precise CRISPR-enabled genome editing, integrated circuits incorporating logic gates for improved tumor targeting, and therapeutic enhancements enabling multiple pharmaceutical functions. With our programmable and computationally driven approach, we aim for enhanced and broader efficacy, increased patient safety, reduced provider costs and expanded market access. Our team is engineering living medicines to attack cancer's inherent multi-faceted nature and bring dramatic improvements to the lives of patients."
Tecton,2019.0,,information technology & services,Series C,http://www.tecton.ai,,"Founded by the team that created the Uber Michelangelo platform, Tecton provides an enterprise-ready AI data platform to help companies activate their data for AI applications. AI creates new opportunities to generate more value than ever before from data. Companies can now build AI-driven applications to automate decisions at machine speed, deliver magical customer experiences, and re-invent business processes. But AI models will only ever be as good as the data that is fed to them. Today, it's incredibly hard to build and manage AI data. Most companies don't have access to the advanced AI data infrastructure that is used by the Internet giants. So AI teams spend the majority of their time building bespoke data pipelines, and most models never make it to production. We believe that companies need a new kind of data platform built for the unique requirements of AI. Tecton enables AI teams to easily and reliably compute, manage, and retrieve data for both generative AI and predictive ML applications. Our platform delivers features, embeddings, and prompts as rich, unified context, abstracting away the complex engineering involved in data preparation for AI. With Tecton, companies can: 1. Productionize context faster, getting new models to production 80% faster 2. Build more accurate models through rapid data experimentation and 100% accurate context serving 3. Drive down production costs by turning expensive workloads into highly efficient data services We believe that by getting the data layer for AI right, companies can get better models to production faster, driving real business outcomes. Tecton enables organizations to harness the full potential of their data, creating AI applications that are contextually aware and truly intelligent."
Tools for Humanity,2019.0,,information technology & services,Series C,http://www.toolsforhumanity.com,,Tools for Humanity is a technology company built to ensure a more just economic system.
Fountain,2014.0,,information technology & services,Series C,http://www.fountain.com,,"Fountain's all-in-one high volume hiring platform empowers the world's leading enterprises to find the right people through smart, fast, and seamless recruiting. Candidates can apply anytime, anywhere in minutes, right from their phone. Automated and customizable processes streamline the candidate experience and save time for recruitment teams so they can scale with growing hiring needs. Advanced analytics provide end-to-end process visibility so managers can make swift, data-driven decisions. Throughout the candidate journey, the openly integrated platform enables companies to find, qualify and convert more applicants. Fountain's global customers hire over 1.2 million workers annually in 78 countries. Why Work with Us: - Generous compensation - 100% Remote and Flexible Hours - Unlimited PTO - Equity grants - Comprehensive healthcare benefits - 16 weeks paid parental leave for all parents - Wellness and gym reimbursement - Home office stipend - Phone stipend - 401K plan - Learning and development reimbursement - Company events - FSA & HSA - Life Insurance & Long-Term Disability/Short-Term Disability Visit us at https://get.fountain.com to learn more."
Omnissa,2003.0,,information technology & services,Series C,http://www.omnissa.com,,"Omnissa is the digital work platform leader, trusted by thousands of organizations worldwide as the former VMware End-User Computing business. We make digital work, work – for businesses and their people. No painful IT processes or productivity trade-offs. Instead, a seamlessly delivered digital employee experience that simplifies work. Our comprehensive digital work platform enables IT teams to provide secure, personalized experiences for every employee, on any device. Omnissa unifies, automates, and efficiently scales the digital workspace. By empowering employees to do their best work, anywhere, we help workforces everywhere unlock exponential business value. All is made possible with the Omnissa™ Platform, the first AI-driven digital work platform for smart, seamless, and secure work experiences from anywhere. It integrates multiple industry-leading solutions across Unified Endpoint Management, Virtual Desktops and Apps, Digital Employee Experience, and Security and Compliance. By continuously adapting to users' work styles, Omnissa optimizes user experience, security, IT operations and costs."
Moveworks,2016.0,,information technology & services,Series C,http://www.moveworks.com,,"Moveworks is the AI Copilot that takes the friction out of work. It unifies every business system with natural language, giving employees one place to go to find information, automate tasks, and be more productive, increasing employee efficiency and satisfaction by streamlining everyday tasks. Powered by an agentic AI infrastructure that leverages the world's most advanced LLMs and our proprietary MoveLM models, the Moveworks Copilot understands employee requests, devises intelligent plans to achieve them, and then executes actions to complete tasks across application boundaries. The world's most recognizable brands like Databricks, Broadcom, Hearst, and Palo Alto Networks trust Moveworks to automate repetitive support issues, to provide a universal search interface, and for common use cases across different applications. Learn more at moveworks.com"
Paragon,2019.0,,information technology & services,Series A,http://www.useparagon.com,,"Shipping the integrations your customers need is expensive and difficult. Whether you need to sync data with their other tools, ingest contextual data for a RAG pipeline, or automate tasks in your users' workflows, the engineering lift is enormous. That's why companies like Copy.ai, Writesonic, AI21, and more rely on Paragon - so they can build scalable and reliable integrations at scale, with a fraction of the engineering. Paragon's embedded integrations platform takes care of all the hard engineering problems around building integrations, with: - Fully managed authentication - Managed webhooks and API abstractions - Built-in smart rate limits and error-handling - Robust monitoring & debugging tools - An enterprise-ready workflow engine and much more. Learn more and sign up for free at useparagon.com. Founded in 2019, Paragon works has raised over $16M from world-class investors like Inspired Capital, Y Combinator, Global Founders Capital, and Village Global, and have been featured in Techcrunch and Forbes."
Savant Labs,2021.0,,information technology & services,Seed,http://www.savantlabs.io,,"It needs to be faster and easier to build game-changing analytics. That's why we created the world's first analytics automation platform. Using Savant, leading companies are seeing 5x more impact from analytics with: • Streamlined report building • Continuous data enrichment • Automated decision-making • Sharable analytics apps Want to turbocharge your analytics? Try Savant today!"
Gretel,2020.0,,information technology & services,Series B,http://www.gretel.ai,,"Gretel is solving the data bottleneck problem for AI scientists, developers, and data scientists by providing them with safe, fast, and easy access to data without compromising on accuracy or privacy. Designed by developers for developers, Gretel's APIs make it easy to generate anonymized and safe synthetic data so you can preserve privacy and innovate faster. You can learn more about synthetic data from Gretel's engineers, data scientists, and AI research team on our blog: https://gretel.ai/blog"
Radius,2015.0,,real estate,Series B,http://www.radiusagent.com,,"Radius is the premier tech-driven brokerage firm for real estate professionals eager to grow their brands and profits. From networking opportunities, branding/marketing resources, to white-glove services for buyers and sellers, Radius empowers real estate professionals to grow their businesses while saving them time and money. Founded in 2015, Radius is backed by the founders of Trulia, Zillow and Roofstock. Visit https://www.radiusagent.com/ to learn more."
