company_name,founded_year,location,industry,latest_funding,website,linkedin,description
ArangoDB,2015.0,,information technology & services,Series B,http://www.arangodb.com,,"ArangoDB is the company behind ArangoGraph Insights Platform: a next-generation graph data and analytics platform that uncovers insights in difficult or impossible data with traditional SQL, document, or even other graph databases – making it easier to drive value from connected data faster. ArangoGraph Insights Platform is the scalable backbone for graph analytics and complex data architectures for thousands of Fortune 500 enterprises and innovative startups across many different industries, including financial services, healthcare, and telecommunications. Founded in 2015 in Cologne, Germany, ArangoDB Inc. is a venture-backed, next-generation graph data and analytics company headquartered in San Francisco, California, with offices and employees worldwide. Learn more at www.arangodb.com."
Caelux,2014.0,,semiconductors,Series A,http://www.caelux.com,,"Caelux's proprietary technologies improve the performance of any new crystalline silicon module, making solar energy more powerful and cost-effective. Headquartered in Baldwin Park, California, Caelux is at the forefront of the emerging science of perovskites, a special class of nanomaterials. Its flagship product, Caelux™ One is an innovative product that integrates seamlessly into existing PV module manufacturing processes, boosting performance, reducing installed costs, and accelerating the proliferation of solar. Headquartered in Pasadena, California, Caelux is at the forefront of the emerging science of perovskites, a special class of nanomaterials. Its flagship product, Caelux™ One is an innovative product that integrates seamlessly into existing PV module manufacturing processes, boosting performance, reducing installed costs, and accelerating the proliferation of solar."
Tillster,2002.0,,information technology & services,Series A,http://www.tillster.com,,"Tillster is a unified commerce platform for multi-unit chain restaurants globally that enables restaurant brands to drive sales across all ordering and delivery touch points, deliver personalized experiences and increase guest engagement and retention. We empower restaurant brands looking to increase revenue, achieve operational efficiencies, and better engage guests. Enabling nearly 50 million digital orders per year, it offers the added dimension of integrated marketing and data mining, including a proprietary AI and machine-learning tool. With teams in North America, Latin America, EMEA and APAC, we serve more than 100 global and regional brands, including Burger King, Baskin-Robbins, Godfather's Pizza, Jollibee and Pollo Campero. For more information, please visit www.tillster.com."
InvestorFlow,2015.0,,information technology & services,Series A,http://www.investorflow.com,,"InvestorFlow is the leading industry cloud for the alternative assets industry, turning relationships into capital, investment opportunities and partnerships. InvestorFlow's client management and investor relations solution suite powers fundraising and deal cycles through investor and fund reporting for the leaders in private equity, venture capital and real estate investment. Built on Salesforce, InvestorFlow is the only solution provider to integrate fundraising, deal sourcing, pipeline management, reporting and investor services in one cloud-native suite. InvestorFlow helps private market firms find opportunities, create and manage relationships, and turn insights into action. InvestorFlow's client base includes 25 of the top 50 alternative asset managers, with more than $6 trillion in assets, 750 funds and 90,000 limited partners. InvestorFlow is headquartered in Menlo Park, California, and has offices throughout North America, in the Dominican Republic, and London."
Nexla,2016.0,,information technology & services,Series A,http://www.nexla.com,,Nexla is a California-based collaborative data operations platform that offers solutions including data flow management and monitoring for sectors such as retail and finance.
Multiply Labs,2016.0,,industrial automation,Series A,http://www.multiplylabs.com,,Multiply Labs develops advanced robotic systems that manufacture individualized drugs at scale. Our products are enabled by the combination of pharmaceutical science with robotics technology. Multiply Labs has built and operates a unique robotic pharmaceutical manufacturing facility in San Francisco.
Incredible Health,2017.0,,information technology & services,Series B,http://www.incrediblehealth.com,,Incredible Health is a California-based career marketplace that connects healthcare workers with hospitals for employment opportunities.
Bellwether Coffee,2013.0,,,Series B,http://www.bellwethercoffee.com,,"Take full control of your coffee from farm to cup and deliver a superior customer experience. Roasting onsite with Bellwether saves you significant costs over wholesale, eliminates problems with freshness and consistency, and produces the lowest carbon coffee on the market. Simple to install and simple to operate, Bellwether enables anyone to source and roast the highest quality, most sustainable coffee at the touch of a button. No gas lines, vents, construction or training required. Bellwether is creating the sustainable future of coffee with our innovative technology which reduces 90% of the carbon from coffee roasting, and our Green Coffee Marketplace which supports farmers through our Living Income Pricing and Farmer Impact Fund initiatives. Grow your business with your own brand of better, fresher, more sustainable coffee."
Pyka,2017.0,,aviation & aerospace,Series B,http://www.flypyka.com,,"Pyka's goal is to provide society with a new form of safe, clean, and cost-effective transportation enabled by autonomous electric aviation. To get there, we're taking a different approach than most. We're applying our technologies to every industry where autonomous electric aircraft can be useful, starting with the highest value and most dangerous jobs. In doing so, we're building game-changing products manufactured at scale, while perfecting the safety, reliability, and capabilities of our autonomy engine and electric propulsion systems. We design, develop and manufacture an ecosystem of technologies including proprietary flight control software, avionics, high power density motors, motor controllers, batteries, and custom carbon-fiber composite airframes. Today, we supply autonomous electric aircraft for cargo transport and crop protection to real-world customers across four separate continents and have secured industry-first regulatory approvals from the FAA. Our cargo aircraft enables remote connectivity, enhances express delivery networks, and ensures fast and reliable shipping of critical supplies to areas in need. Our crop protection aircraft offers agricultural services providers and farmers an autonomous tool to make aerial application safer, more precise, and less harmful to surrounding environments. Both vehicles are highly economical to operate, easy to deploy, and significantly reduce C02 emissions in their respective industries. What we work on at Pyka makes people's lives better now and brings the future of electric aviation one step closer each day."
Klarity,2017.0,,information technology & services,Series B,http://www.klarity.ai,,"Klarity is building fully automated back-office for enterprise. Our customers like DoorDash, Cloudflare, CrowdStrike and others use Klarity to achieve instant turnaround time, unmatched accuracy and OpEx reduction."
Render,2018.0,,information technology & services,Series B,http://www.render.com,,Render is the modern cloud for developers and software teams of all sizes.
Monarch Money,2018.0,,information technology & services,Seed,http://www.monarchmoney.com,,Monarch is the most comprehensive platform for managing your personal finances.
Eluvio,2017.0,,information technology & services,Series A,http://www.eluv.io,,"Eluvio is transforming the management, distribution, and economics of premium video for content owners. The Eluvio Content Fabric is a global platform service that enables just-in-time, low-latency content distribution, monetization, and asset servicing directly to consumers. Content is delivered directly from source as on-demand streams, live streams, and dynamic sequences–without the use of separate transcoding services, content delivery networks (CDNs), or aggregation services–and without creating file copies. An embedded blockchain ledger, contract-backed content, and dynamic composition enable personalization, rights control, monetization, and re-use of media and metadata across properties and devices. Open source APIs are available for publishing content to the Fabric, streaming and downloading from the Fabric, and URL-based consumption of static and dynamic content from the Fabric. The Eluvio Content Fabric is being used by Tier 1 Hollywood studios, broadcasters, and new mobile streaming platforms to create more efficient, cost-effective, and faster digital supply chains. The Fabric was awarded the 2020 Engineering Excellence Award by the Hollywood Professional Association (HPA), the 2020 Best Use of Blockchain in Media Award by Cable and Satellite International (CSI), and other industry accolades. Eluvio is led by Michelle Munson and Serban Simu, founders of Aspera, and a core team of innovators in content centric design, ML, blockchain ledgers, audio/video processing, and programmable media. The company also holds several patents in the areas of content networking, ML, blockchain, and cloud infrastructure."
Sonoma Biotherapeutics,2019.0,,research,Series B,http://www.sonomabio.com,,"Sonoma Biotherapeutics is developing engineered regulatory T cell (Treg) therapies to treat serious autoimmune and inflammatory diseases driven by an imbalanced immune system. Founded by pioneers in Treg biology and cell therapy, the company is employing proprietary platform technologies and approaches to develop a new generation of targeted Treg cell therapies designed to induce durable immune tolerance to treat and prevent autoimmune and inflammatory diseases. Sonoma Biotherapeutics is based in South San Francisco and Seattle."
Zadar Labs,2019.0,,information technology & services,Seed,http://www.zadarlabs.com,,"Zadar Labs is developing next generation Software-Defined 4D Imaging Radar (SDIR) platforms. Our vision is to empower perception systems with flexible, high performance radar. At Zadar we see a future where every system that perceives the world is better with radar. We are founded on the idea that radar should be a tool, not a hurdle."
Standard Metrics,2020.0,,information technology & services,Series A,http://www.standardmetrics.io,,"Standard Metrics is an automated data platform that enables financial transparency between startups and investors, empowering founders to make better decisions in scaling their companies."
Mapped,2013.0,,information technology & services,Seed,http://www.mapped.com,,"Mapped is an AI-powered independent data layer for commercial and industrial IoT. Our mission is to help customers securely access real-time data from people, places and things by automating the data discovery, normalization, and enrichment process. We empower enterprises and developers to create new revenue possibilities, optimize operations, and accelerate innovation."
Kikoff,2019.0,,information technology & services,Series B,http://www.kikoff.com,,"Kikoff was founded in 2019 with a not-so-simple goal: make it easier for people to build credit. Credit plays a huge role in our lives, from opening a credit card to qualifying for a home loan. But there's a catch, it's easier to build credit, when you already have it. ‍ Co-founders Cynthia Chen and Christophe Chong understood this challenge first hand, so they built a solution. Kikoff's main product is our Credit Account, a specialized, reported credit line exclusively focused on building credit. We've expanded the features of our paid account to include things like spam call blocking, identity protection, rent reporting, and more. Over a million people have used Kikoff to build their credit."
Fieldguide,2020.0,,information technology & services,Series B,http://www.fieldguide.io,,"Fieldguide offers market-leading Artificial Intelligence that helps Advisory and Audit firms grow. Built by Big Four practitioners and Silicon Valley technologists, our AI platform digitizes the end-to-end engagement lifecycle — delivering dramatically better results to professionals and their clients. Fieldguide is trusted by top CPA and consulting firms to unlock growth, increase margins, and delight clients. Fieldguide AI is award winning, having been recognized by CPA Practice Advisor (3x Technology Innovation Award) and Accounting Today (3x Top New Product). The company is based in San Francisco, and has raised $50M from top Silicon Valley investors like Bessemer Venture Partners, 8VC, Floodgate, Y Combinator, Fourth Realm, Justin Kan, Eric Ries, Elad Gil, Qasar Younis, Tracy Young, and many more."
Cambly Inc.,2013.0,,e-learning,Series B,http://www.cambly.com,,The Cambly app gives English learners instant 1-on-1 access to friendly native speakers over video chat 24/7. Students get an affordable and convenient way to practice their English and gain confidence. Tutors get to make money helping people from around the world practice English.
Little Otter,2020.0,,mental health care,Series A,http://www.littleotterhealth.com,,"Little Otter is a pediatric mental health company that focuses on the mental health of young children and their families. Founded by world-renowned child psychiatrist (and mother of four) Dr. Helen Egger and entrepreneur Rebecca Egger, Little Otter's mission is to bring expert care for children's mental health to every home. Just like a pediatrician who cares for a child's physical health, Little Otter cares for all aspects of a child's mental health, along with their family's mental health and wellbeing. Through proprietary assessments and quarterly mental health check-ups for each child and their family, Little Otter provides personalized, virtual care and an integrated care team to support healthy emotional development and treat emerging emotional and behavioral challenges."
MERIT,2021.0,,"health, wellness & fitness",Series A,http://www.meritbeauty.com,,MERIT is the antidote to the overwhelming world of beauty. We simplify what it takes to get ready by creating well-edited essentials that help you do more with less. We believe in creating impossible-to-mess-up products that are designed to meet the reality of your daily routine. This is makeup you can live in.
Replicate,2019.0,,information technology & services,Series B,http://www.replicate.com,,Run machine learning models in the cloud
Atomic AI,,,research,Series A,http://www.atomic.ai,,"Atomic AI is a well-funded, early-stage biotech company transforming the rational design of molecules and medicines through the cutting-edge fusion of artificial intelligence and structural biology. Atomic's unique R&D platform, based on research featured on the cover of Science (doi.org/10.1126/science.abe5650), provides new strategies to treat or cure previously-undruggable diseases by targeting RNA structure. We are an interdisciplinary team working across computational and experimental biology and believe that our strongest asset is our people. We're hiring! https://boards.greenhouse.io/atomai"
Loop,,,information technology & services,Series B,http://www.loop.com,,Payments made simple in the most complicated business on Earth.
Conduit,,,information technology & services,Series A,http://www.conduit.xyz,,"Fully-manged, production-grade rollups on Ethereum. Deploy with no-code in just a few clicks. We're live on mainnet!"
Charlie,1878.0,,financial services,Series A,http://www.charlie.com,,"Are you 62+? Welcome to Charlie. Banking* built for you *Charlie is a financial technology company, not a bank. Banking services provided by Sutton Bank, Member FDIC."
Quilt,2022.0,,machinery,Series A,http://www.quilt.com,,"Quilt creates home climate systems designed to move humanity off fossil fuels. As the smartest way to heat and cool your home, Quilt blends seamlessly into any home environment, offering intuitive room-by-room control, occupancy awareness for unmatched energy efficiency, and predictive technology. Learn more and reserve yours at Quilt.com"
Eve,,,information technology & services,Seed,http://www.eve.legal,,Eve optimizes your casework from intake to resolution. Seamlessly integrate an AI case assistant that optimizes your firm into an AI-native powerhouse - securely and responsibly.
Blue Bottle Coffee,2002.0,,food & beverages,Series C,http://www.bluebottlecoffee.com,,"""Blue Bottle is coffee and people. Not necessarily in that order."" —James Freeman, Founder In our eyes, coffee's main purpose is to be delicious. We go to great lengths to source, roast, taste, and prepare coffee so our guests can enjoy it at peak deliciousness. We know that good coffee depends on strong community. We work directly with farmers around the world to source our coffees as sustainably and ethically as we can. We hire team members who are dedicated to creating beautiful experiences with coffee. From the farm to the cafe, our coffee is handled by people who care."
Kiddom,2015.0,,e-learning,Series C,http://www.kiddom.co,,"Kiddom is a technology company in love with the power of core curriculum. For the first time, digital curriculum, instructional tools, and assessments are connected and integrated, all in one place. Using Kiddom, classrooms get the highest quality digital curriculum, saving teachers time and enabling students to take engaging, interactive assessments. Performance data is instantly accessible via beautiful, actionable reports, and teachers finally have the insight they need to offer targeted personalized support."
ATTN:,2014.0,,entertainment,Series C,http://www.attn.com,,"ATTN: is a media company built for the attention era. In addition to being a social video publisher, we're a production studio and creative agency offering best-in-class storytelling, audience insights, and social content creation. We call attention to the inspiring, the innovative, and the untold, through meaningful stories with macro impact."
ChowNow,2011.0,,information technology & services,Series C,http://www.chownow.com,,"ChowNow powers online ordering systems for independent restaurants via restaurants' own websites, Facebook and Google pages, apps, and ChowNow's website. ChowNow consolidates 1st and 3rd party ordering into one central hub so restaurant owners don't have to juggle multiple tablets. We do all of this without the predatory third-party commissions charged by the other guys."
Rescale,2011.0,,information technology & services,Series C,http://www.rescale.com,,"Rescale's cloud platform for modeling & simulation and applied AI accelerates product development and discovery for any organization. Enterprises use Rescale's compute, data, and AI solutions to accelerate discovery and engineering breakthroughs. Rescale has been recognized globally as the industry leading platform providing cutting edge AI solutions, the broadest selection of over 1,000 R&D software applications, and the largest global infrastructure footprint of 100s of advanced computing architectures. Leveraged by a majority of Fortune 500 companies to accelerate time to market, Rescale has been recognized by Gartner as a Cool Vendor for Cloud Infrastructure, by Deloitte as a Technology Fast 500 company, and by the World Economic Forum as a Global Innovator Unicorn. We are located in San Francisco and work with users in the aerospace, automotive, energy, life sciences, construction, marine, consumer products, and manufacturing industries. For more info sales@rescale.com"
Calm,2012.0,,mental health care,Series C,http://www.calm.com,,"Calm is the leading mental wellness brand with the #1 App for Sleep, Meditation and Relaxation™, designed to help you manage stress, sleep better and live a happier, healthier life. With hundreds of hours of original audio content available in seven languages, Calm supports users in more than 190 countries. Apple's 2017 iPhone App of the Year and one of Fast Company's Most Innovative Companies of 2020, Calm boasts over 100 million downloads to date, with more than 4 million paying members. As a corporate solution, the much-loved consumer app offers a 360-approach to mental fitness and resilience as an employee benefit, with Calm for Business. Calm was co-founded by Alex Tew (Million Dollar Homepage) and Michael Acton Smith (Mind Candy, Moshi Monsters, Firebox)."
EarnIn,2012.0,,financial services,Series C,http://www.earnin.com,,"EarnIn lets you access your money as you earn it — not days or weeks later. We're reimagining the way money moves to make financial momentum accessible to everyone. That starts with payday every day and builds with tools like credit monitoring, automated savings accounts, and low-balance protection. All with no interest, no credit checks, and no mandatory fees. So our customers have as many options as possible to save and spend on their terms. EarnIn's pioneering Earned Wage Access app is backed by world-class partners like A16Z, Matrix Partners, and DST. Since our founding in 2013, 3.8 million customers have given it over 380,000 5-star reviews for helping them access over $15 billion in earnings. That means: - 49% can now cover an unexpected expense of $400 since using EarnIn - 73% can budget more effectively with EarnIn - 66% have been able to pay bills on time with EarnIn's help We're proud of that impact. Because no one should feel stuck — held back from their ambitions, their life — simply because they can't access the money they've already earned. That's why EarnIn is here, to help people move forward with the lives they want today and the goals they have for tomorrow. Join us. EarnIn is a financial technology company, not a bank. The Deposit Account, Secured Account, and EarnIn Card are issued by Evolve Bank & Trust, Member FDIC. The EarnIn Card is issued pursuant to a license from Visa USA Inc."
Carrot Fertility,2016.0,,hospital & health care,Series C,http://www.get-carrot.com,,"Carrot is a California-based fertility benefits platform that provides services such as fertility coverage, pregnancy and parental benefits programs for employers."
Artera,2015.0,,hospital & health care,Series C,http://www.artera.io,,"Artera is a SaaS digital health leader redefining patient communications. Artera is trusted by 800+ healthcare systems and federal agencies to facilitate approximately 2.2 billion messages annually, reaching 100+ million patients. The Artera platform integrates across a healthcare organization's tech stack, EHRs and third-party vendors to unify, simplify and orchestrate digital communications into the patient's preferred channel (texting, email, IVR, and webchat), in 109+ languages. The Artera impact: more efficient staff, more profitable organizations and a more harmonious patient experience. Founded in 2015, Artera is based in Santa Barbara, California and has been named a Deloitte Technology Fast 500 company (2021, 2022, 2023), and ranked on the Inc. 5000 list of fastest-growing private companies for four consecutive years. Artera is a two-time Best in KLAS winner in Patient Outreach."
Ordr Inc.,2015.0,,computer & network security,Series C,http://www.ordr.net,,"See. Know. Secure. Every connected asset everywhere. Our mission is to make the connected world a safer place. Digital transformation has led to the explosive increase of connected assets and expanded boundaries for enterprises. Each unknown, unmanaged, and unsecured asset increases an organization's attack surface. Ordr addresses the entire asset management journey. Using a ""whole enterprise"" philosophy and the Ordr Data Lake populated with a rich and growing library of millions of detailed asset profiles, powered by AI/ML classification and data analytics, Ordr identifies and secures every asset in the network -- IT, IoT, IoMT, OT devices, users, SaaS and cloud workloads. Ordr maps the enterprise attack surface, prioritizes vulnerabilities and risks, accelerates segmentation and protects each device against cyberattacks with automated policies. Trusted by global enterprises across various sectors, our platform delivers a single source of truth on every asset, enabling security, IT and device teams to save time, reduce risks, accelerate incident response, and increase collaboration. We are funded by Battery Ventures, TenEleven Ventures, Wing Venture Capital, Northgate Capital and Unusual Ventures, along with Mayo Clinic Ventures and Kaiser Permanente Ventures."
AssemblyAI,2017.0,,information technology & services,Series C,http://www.assemblyai.com,,"AssemblyAI is a Speech AI company focused on building new state-of-the-art AI models that can transcribe and understand human speech. Our customers, such as CallRail, Fireflies, and Spotify, choose AssemblyAI to build incredible new AI-powered experiences and products based on voice data. AssemblyAI models and frameworks include: - AI Speech-to-Text - Audio Intelligence, including Summarization, Sentiment Analysis, Topic Detection, Content Moderation, PII Redaction, and more - LeMUR, a framework for applying powerful LLMs to transcribed speech, where you can ask sophisticated questions, pull action items and recaps from your transcription, and more To see AssemblyAI in action, choose your favorite audio or video file and upload it into our no-code playground: https://www.assemblyai.com/playground. Also, check out our customer stories and blog: https://www.assemblyai.com/blog."
