company_name,founded_year,location,industry,latest_funding,website,linkedin,description
Censys,2017.0,,computer & network security,Series C,http://www.censys.com,,"Censys is the one place to understand everything on the internet. We have built and operate the world's largest internet scanning infrastructure and we empower organizations, individuals and security researchers by providing unparalleled visibility into the global internet landscape. We see more of the internet than anyone else, which gives us the most comprehensive internet visibility in the world. Our two main use cases are attack surface management and threat hunting with so many more on the horizon. Through our comprehensive internet data, we strive to enhance cybersecurity, facilitate data-driven decision-making, and reduce internet exposures for commercial and government organizations across the globe."
OVERJET,2018.0,,information technology & services,Series C,http://www.overjet.com,,"Overjet is the world-leader in dental AI. Founded by experts from MIT and Harvard University, Overjet builds artificial intelligence that helps dental organizations give patients the highest quality of care. Our FDA-cleared technology is the first objective standard for making oral health decisions — so that dentists can detect pathologies with precision and educate patients with confidence."
Docugami,2017.0,,information technology & services,Seed,http://www.docugami.com,,"Docugami is Generative AI for business documents. Our patented AI is designed and trained exclusively for business scenarios, to automatically unlock the critical information in your company's documents and use that information to generate reports, insights, new documents, and data streams to power your business processes. Docugami provides a family of Large Language Models (LLMs) trained on millions of Business Documents, ranging from 2.7B to 20B parameters. Docugami is designed to provide immediate value to front-line business users and managers, without costly investments in IT projects or training. Docugami turns your unique business documents into data; all content generated is derived exclusively from your own business documents -- not random content on the Internet -- minimizing any potential for erroneous or inappropriate content generation. Each customer's data, feedback, and generated content are completely separate and secure. Docugami is cross-segment and in the market today in a variety of vertical industry segments, including Commercial Insurance, Commercial Real Estate, Technology, a wide range of Professional Services sectors, and more. Hiring Machine Learning PhD/MS Students & Brilliant Developers. Contact Jean Paoli at jeanpa@docugami.com"
Parse Biosciences,2018.0,,research,Series C,http://www.parsebiosciences.com,,"Parse Biosciences is a global life sciences company whose mission is to accelerate progress in human health and scientific research. Empowering researchers to perform single cell sequencing with unprecedented scale and ease, our pioneering approach is enabling groundbreaking discoveries in cancer treatment, tissue repair, stem cell therapy, kidney and liver disease, brain development, and the immune system."
CHAMP,2018.0,,information technology & services,Series C,http://www.champtitles.com,,"Founded in 2018, CHAMP Titles is a leading provider of digital vehicle title, registration, and lien systems of record in the United States. The company's patented SaaS (Software as a Service) platform leverages Hyperledger Fabric to digitally manage automotive titles."
Petfolk,2020.0,,veterinary,Series C,http://www.petfolk.com,,"We're Petfolk. And we're reshaping pet care as we know it. Founded and led by vets, Petfolk understands what it takes to provide world-class veterinary care. When too often the veterinary experience falls short, we're here to make it better for everyone: pets, their parents, and vets alike. Our goal is to integrate everything pets and their parents need in their journey — from scheduled on-site care to virtual visits. We believe the easier it is for the parent, the healthier and happier the pet. On a deeper level, we see ourselves as part of a greater community of people with pets. We share the same values all devoted pet parents do, and we understand the bond between pets and their owners inherently. Most important, our support is as much for you as it is for your pet. We believe that with the right tools and knowledge, you're empowered to make the best decisions possible for them. It's a journey, and we'll always be by your side for it."
Iterion Therapeutics,2014.0,,research,Series B,http://www.iteriontherapeutics.com,,"Iterion Therapeutics is a clinical stage biopharmaceutical company focused on developing novel cancer therapeutics. The company's lead product, tegavivint, is a highly specific and potent first-in-class small molecule inhibitor of TBL1 (Transducin Beta-Like Protein 1), a novel downstream target of the canonical Wnt/beta-catenin signaling pathway. Iterion is advancing clinical programs of tegavivint in tumor types with a high prevalence of Wnt/beta-catenin activating mutations, such as hepatocellular carcinoma. In parallel, the company has deep collaborative relationships with leading institutions studying tegavivint in complementary investigator-sponsored trials in acute myeloid leukemia, non small cell lung cancer, pediatric tumors and lymphoma."
Mosaic,1913.0,,hospital & health care,Series C,http://www.mosaicinfo.org,,"Mosaic is a whole-person healthcare organization reaching across 12 states in more than 750 communities providing supports to approximately 5,000 people. Services empower people with disabilities, mental and behavioral needs and autism, as well as aging adults to live their best life. Mosaic is an affiliated social ministry organization of the Evangelical Lutheran Church in America and a member of Lutheran Services in America. Mosaic is a nonprofit 501(c)(3) organization. For more information, visit MosaicInfo.org."
Ensoma,2019.0,,research,Series B,http://www.ensoma.com,,"Ensoma /en'sōmə/ is derived from the Greek phrase ""en soma,"" meaning in the body. We develop one-time in vivo treatments that precisely engineer any or all blood and immune cells to cure diseases from within. We have a bigger, bolder vision for genomic medicine: treatments as versatile, precise, and far-reaching as the body's own cells. Our team takes inspired action towards pushing beyond today's possible with the goal of delivering a one-time, off-the-shelf treatment to patients everywhere."
Caribou Financial,2016.0,,financial services,Series C,http://www.caribou.com,,"At Caribou, we believe that taking control of your car payment should be a simple, transparent process. Too many people are driving around with a bad deal on their auto loan. What's more, many people don't realize it, or don't know what to do about it. Through our partnerships with local and community lenders, we connect customers with competitive rates and lower monthly payments. NMLS #1746612 NMLS Consumer Access: https://www.nmlsconsumeraccess.org/EntityDetails.aspx/COMPANY/1746612?slug=newsroom"
MotherDuck,2022.0,,information technology & services,Series B,http://www.motherduck.com,,"Making analytics fun, frictionless and ducking awesome with a cloud data warehouse based on DuckDB's efficiency, ergonomics and performance in collaboration with the folks at DuckDB Labs."
Gridwise,2016.0,,information technology & services,Series A,http://www.gridwise.io,,"Gridwise is the leading business app for gig drivers empowering over 150k drivers across the US each month. Gridwise also empowers businesses by providing access to gig mobility data, targeted driver advertising, and partnerships to jointly benefit drivers or enhance data offerings."
Jnana Therapeutics,2017.0,,biotechnology,Series C,http://www.jnanatx.com,,Jnana is a Massachusetts-based biotechnology company that researches and develops small-molecule medicines for the treatment of immune-mediated diseases.
Qnergy,2013.0,,oil & energy,Series C,http://www.qnergy.com,,"Qnergy is dedicated to providing reliable methane abatement solutions across industries. Leveraging the exceptional capabilities of our linear Free Piston Stirling Engine, we harness low-grade, otherwise polluting, methane into useful power. The Compressed Air Pneumatics (CAP) product line, a leading Qnergy application, replaces vented methane from pneumatic devices with clean, dry instrument air. We have already deployed thousands of units, leading to emission reduction of millions of tonnes of CO2e."
First Insight,2007.0,,information technology & services,Series B,http://www.firstinsight.com,,"Founded in 2007, First Insight transformed retail decision-making by combining AI, predictive analytics, and human insight. As a leader in human-AI collaboration for over 17 years, First Insight has empowered brands—including Under Armour, Woolworths, Family Dollar, Kohl's, and Francesca's—with actionable Voice of the Customer (VoC) insights to anticipate shopper preferences, launch winning products, and optimize strategies. Today, First Insight leads the industry in AI and generative AI applications for retail with its proprietary Value Score™, which directly impacts financial outcomes like increased sales, higher margins, and reduced markdowns. By blending human creativity with AI-driven analytics, First Insight helps companies eliminate guesswork, enhance customer satisfaction, boost profitability, and stay competitive. Committed to driving sustainable growth, First Insight is transforming how retailers engage with and understand their customers. Fun Fact: 98% of our customers would recommend First Insight We asked them why, and here is what they shared: -Industry-Leading Technology -Actionable Data -Proven ROI -Speed & Scale -A Better Signal -Start at Any Level & Expand -Global & Mobile Reach We take pride in highlighting our consistent endorsements from renowned industry analysts, including Forrester, IDC, and Gartner, spanning more than 15 years."
Carbice,2011.0,,semiconductors,Series A,http://www.carbice.com,,"We protect electronics from heat and drive performance with the new standard for thermal interface solutions and expertise. We are a global leader in delivering the promise of aligned carbon nanotubes at scale. We help our partners, customers, employees, and stakeholders Achieve More. Carbice is the material for Pioneers."
Shipium,2019.0,,logistics & supply chain,Series A,http://www.shipium.com,,"Shipium drives cost savings throughout the supply chain that can shift money towards the premium delivery experience that your consumers want—great transparency, more convenience, and faster speed. We help you turn logistics into a strategic differentiator for growth."
MAI,2016.0,,information technology & services,Seed,http://www.mai.ai,,"Augmented Intelligence, Inc., doing business as MAI (which stands for Medical Augmented Intelligence), is a team of pioneers unraveling the universe of medicine. The world is big, and we are like ants trying to discover humans. We may be small and fragile and comfortable with not knowing everything, but we try our best to know the unknown, and do the undone."
TraceSecurity,2004.0,,computer & network security,Series C,http://www.tracesecurity.com,,"TraceSecurity is a leading cybersecurity services company, providing a broad range of services and solutions in IT security compliance, risk and vulnerability management, and independent assessments and testing. TraceSecurity focuses on the intersection of business and information security to enable our clients to create value through their security compliance practices and promote business growth. With market experience that spans over 2,000 customers, TraceSecurity offers the insight, products, professional services and partners to support the security and risk management efforts of organizations of all sizes across all industries."
Vytalize Health,2014.0,,hospital & health care,Series C,http://www.vytalizehealth.com,,"Vytalize Health is a leading value-based care platform. It helps independent physicians and practices stay ahead in a rapidly changing healthcare system by strengthening relationships with their patients through data-driven, holistic, and personalized care. Vytalize provides an all-in-one solution, including value-based incentives, smart technology, and a virtual clinic that enables independent practices to succeed in value-based care arrangements. Vytalize's care delivery model transforms the healthcare experience for more than 250,000+ Medicare beneficiaries across 36 states by helping them manage their chronic conditions in collaboration with their doctors."
Empower,1891.0,,financial services,Series A,http://www.empower.com,,"Built on a foundation of trust, integrity and promise, we proudly serve over 71,000 outstanding organizations and more than 17 million individuals. ¹ We take great pride in helping people with saving, investing and advice, while providing them with the tools and resources they need to help reach their financial goals. We're continuing to grow — and innovate — every day. Our mission is to empower financial freedom for all. That mission starts by delivering advice, personalized guidance and critical support. We strive to meet the unique needs of everyone we serve and embrace the opportunity to inspire them along their journey. Disclosures: https://www.empower.com/social-media/. ---------------------------------------------------------------------------------------- ¹ As of April 1, 2022."
Saltbox,2019.0,,logistics & supply chain,Series B,http://www.saltbox.com,,"Saltbox solves the hardest parts of running an ecommerce business with spaces that combine warehousing and co-working, technology to simplify fulfillment and shipping, and expert logistics support to help ecommerce merchants scale. With 12 locations across the United States in major metropolitan areas, Saltbox addresses the most critical challenges ecommerce entrepreneurs face when starting, growing, and scaling their businesses with flexible space, tech, and services."
Paragonix,2010.0,,medical devices,Series B,http://www.paragonixtechnologies.com,,"Paragonix Technologies is a rapidly growing medical device manufacturer that designs, manufactures, and sells organ transplant transport devices. Our dynamic team is committed to improving the lives of transplant patients by providing advanced technologies to ensure optimal preservation for donor organs on the journey to their ultimate recipients. Our primary offices are located in Waltham, MA."
Theoris,1984.0,,management consulting,Seed,http://www.theoris.com,,"A nimble and collaborative strategic data management partner, solving complex enterprise data analytics and integration challenges, Indianapolis-based Theoris - expertly serves clients in life science, healthcare, manufacturing, financial services, and other demanding industries with strategic consulting, managed data solutions, app development and integration, cloud initiatives, and skilled IT and engineering talent acquisition – for over 35 years and counting. From project-based consulting services to full lifecycle support, we have helped champion innovation for over 500 organizations, maximizing technology and leveraging data insights to achieve business goals. Have an IT or engineering conundrum? Don't let technology be your company's stumbling block. Theoris can help with the right IT or engineering solution for your unique challenge. Let's chat!"
Worksoft,1998.0,,information technology & services,Seed,http://www.worksoft.com,,"Worksoft brings clarity to the transformation process. Trusted by many of the top global organizations across diverse industries, our platform supports ERP migrations, deployments, updates, and a wide range of other business applications - whether packaged, custom, or cloud-based. Our no-code platform captures and documents processes with ease, helping IT and Business teams work together to speed up transformation. By automating business process testing, we turn complex challenges into achievable goals, allowing organizations to quickly adapt to changing markets and new technologies without sacrificing quality or efficiency, and our end-to-end automation and continuous testing keep operations reliable and resilient, even at scale. Worksoft helps businesses perform at their best, ensuring that processes are not just running but driving success, regardless of the complexity. For more information, contact Worksoft at info@worksoft.com or visit www.worksoft.com."
EnergySage,2009.0,,internet,Series A,http://www.energysage.com,,EnergySage is a Massachusetts-based online marketplace that enables users to compare and buy solar energy systems.
Cuyuna Regional Medical Center,1964.0,,hospital & health care,Series A,http://www.cuyunamed.org,,"While the medical campus is in Crosby, Minnesota, CRMC draws market share from a much broader region. With 25 operating beds and $120 million in net patient revenues, CRMC established itself as a key asset in the beautiful lake country of eastern Crow Wing County. CRMC has strategically partnered with health institutions to provide a broad array of services that are not typically available at critical access hospitals and has numerous branded service lines. This healthcare system is a testimony to the positive, can-do spirit of its leadership, physicians, and staff. Working together, they established an integrated, 40-acre campus with a state-of-the-art hospital, technologically advanced surgical suites, advanced life support ambulance, senior housing, and a long-term care facility. There are also three physician clinics in Baxter, Breezy Point and Longville. CRMC has 1,020 employees and a medical staff of 60 physicians and 23 advanced practice providers, which includes 15 surgeons and 45 primary care providers. More than 8,500 surgeries are performed annually. CRMC has a strong balance sheet with a solid operating margin and is the largest employer on the Cuyuna Range and the second largest employer in Crow Wing County. CRMC is recognized nationally, regionally, and in the state for excellence. The hospital is accredited by The Joint Commission; The Commission on Cancer; and the Commission on Office Laboratory Accreditation. The Cuyuna Lakes has nearly 6,000 year-round residents and thousands more seasonal residents and visitors. The Cuyuna Country State Recreation Area boasts over 500 lakes and 25 miles of forested shoreline. There are over 30 miles of groomed mountain biking and ATV trails, swimming beaches, a variety of parks, two golf courses, and over 30 camp sites available."
Velocity Global,2014.0,,information technology & services,Series B,http://www.velocityglobal.com,,"Velocity Global gives you the power to build your team everywhere—combining seamless technology and local expertise in 185+ countries. We make it simple to compliantly hire, pay, and manage talent anywhere. With Velocity Global, the world is yours."
Drive My Way,2014.0,,transportation/trucking/railroad,Series A,http://www.drivemyway.com,,"Drive My Way™ is a unique, online, personalized recruiting service that matches CDL truck drivers with available jobs based on their qualifications and personal preferences. It makes the challenge of finding the right employer and the ideal driver much easier than traditional recruiting sites. Through its one-of-a-kind Match My Way™ technology, Drive My Way brings employers and CDL truck drivers together for the best possible fit. Ultimately, employers benefit from the ability to identify which drivers best match their opportunities — and drivers find fulfilling employment that suits their personal preferences regarding schedule, location, benefits and other perks. With Drive My Way, employers can expedite the hiring process and lower recruiting costs, and drivers can search confidentially and use the Match My Way score to identify better-matched jobs. At Drive My Way, we strive to put you in control. Our tagline is My life. My job. My way™. And we mean it.​"
Awardco,2015.0,,human resources,Series A,http://www.award.co,,"Awardco's employee recognition platform builds culture, incentivizes performance, and powers modern engagement strategies. With the largest reward network in the world and the most customizable and flexible employee recognition solution in the industry, Awardco is the leader in employee recognition and rewards."
Kensho,2013.0,,information technology & services,Series B,http://www.kensho.com,,"Kensho is an Artificial Intelligence company that builds solutions to uncover insights in messy and unstructured data that enable critical workflows and empower businesses to make decisions with conviction. With engineers comprising over 75% of our ~100-person team, Kensho is an engineering-driven culture, laser focused on building products that solve our customers' complex problems. Kensho is headquartered in Cambridge, Massachusetts."
Convr,2016.0,,information technology & services,Series A,http://www.convr.com,,"Convr is an AI underwriting, data, and intelligent document processing workbench. We're transforming the commercial insurance business with our modular, end-to-end underwriting AI decisioning engine that supports each insurer's precise underwriting objectives, Convr captures the complete digital profile of a business leading to unprecedented precision in underwriting decision-making. The highly intuitive platform delivers insights and recommendations, including Convr Answers AI that allows users to expand detailed risk information with their own additional questions to make better decisions. With its modular design, Convr supports specific business use cases at each process and digitization stage of development. Convr AI has perfected how commercial insurance businesses access, analyze, and interpret risk data with its single, comprehensive, easy-to-use AI platform built specifically for commercial insurance. Convr AI helps underwriters navigate vast amounts of data, uncover opportunities, and enable automations to support the best user experience while increasing written premiums and improving underwriting profitability. Commercial insurance organizations including three of top 20 carriers, trust Convr to help them transform their underwriting experience with straight-through processing and more comprehensive data. Convr's Underwriting Workbench brings together data, discovery, and decisioning intelligence through its patented AI engine to reduce application questions by over 70% and increase underwriting productivity by up to 10x"
Generation Tux,2015.0,,apparel & fashion,Series B,http://www.generationtux.com,,"Generation Tux is a first-of-its-kind ‘high tech, high touch' online tuxedo and suit rental platform. From trusted entrepreneur George Zimmer, whose pioneering vision is once again revolutionizing how people get dressed and share key life experiences, Generation Tux is changing the way men rent tuxes and suits, making this luxury accessible to all. Distinguished by superior quality and style, a hassle-free online shopping experience and an unrivaled customer service team, Generation Tux is in a league of its own. Visit www.generationtux.com or join the conversation #GENTUX."
Sea Machines Robotics,2014.0,,maritime,Series A,http://www.sea-machines.com,,"Sea Machines Robotics is the lead provider of advanced technology for the marine and maritime sector with a product line of autonomous control and navigation systems for defense and commercial boats and ships. With experienced management, world class automation engineers, and autonomy scientists; Sea Machines is a first-mover in the emerging space of marine autonomy. Sea Machines' base is on the historic waterfront of East Boston, MA. Keep an eye out for our autonomous test vessels plying the seas. Sea Machines. Sea Better."
Stackline,2014.0,,information technology & services,Series B,http://www.stackline.com,,"On a mission to fuel the future of commerce by bringing brands and customers closer together, Stackline is an AI-enabled retail intelligence and activation platform for the world's most innovative brands. Business leaders, product innovators, performance marketers, and financial firms trust Stackline as the single source of commerce truth. Fueled by proprietary neural networks and deep learning systems, Stackline's market insights, revenue metrics, behavioral data, and autonomous functionality create the actions that determine success or failure. Founded in 2014 in Seattle, Stackline employs over 250 connected commerce professionals, creating value for 7,000 global brands."
DeZURIK,1928.0,,machinery,Seed,http://www.dezurik.com,,"DeZURIK is a manufacturer of industrial valves and actuators for municipal and industrial markets including water, waster water, power, mining, paper, chemical, petroleum and petrochem applications. DeZURIK has four manufacturing locations throughout the United States and Canada with company headquarters in Sartell Minnesota. Follow us on: www.facebook.com/DeZURIKAPCOHilton/ twitter.com/DeZURIK_Valves www.instagram.com/dezurik.apco.hilton/"
